109,2023/10/05 2:21:15 p. m. GMT-5,Mamoncillo,Femenino,Importante,Importante,Importante,Importante,Importante,Importante,Importante,Importante,Está un poco golpeada,"Tiene una presencia suave, color piel","No tiene brillo la parte externa, me dan ganas de abrirlo por lo que tiene apariencia de ser comestible internamente",Es dulce y amargo,Es sueve en la parte interna ,"Es dulce y amargo al probarlo, y astringente al final",Me recuerda a tierra caliente,Astringente al final,El fruto no debe presentar pudriciones
110,2023/10/05 2:21:38 p. m. GMT-5,Mamoncillo,Masculino,Importante,Importante,Moderadamente importante,Importante,Importante,Muy importante,Muy importante,Nada importante,Algo clorotico,Buen aspecto,"Sin brillo, maltrato",Buen aroma,Exotico,Placer,Tropico,Ricura,Buen estado
111,2023/10/05 2:24:34 p. m. GMT-5,Mamoncillo,Masculino,Importante,Importante,Importante,Importante,Importante,Importante,Importante,Poco importante,"Opaco, deshidratado un poco ",Deshidratado ,"Sin brillo, color opaco",,,Ácido,"Mi papá, cuidado con la Pepa! ",Me gusta,"Frescura, que este bien jugoso "
112,2023/10/05 2:27:40 p. m. GMT-5,Mamoncillo,Masculino,Importante,Importante,Poco importante,Importante,Moderadamente importante,Importante,Moderadamente importante,Nada importante,"Carrasposo, de tamaño normal, con algunas muestras de lesiones",Del color que uno espera para esa fruta,No tiene brillo,Un aroma suave a dulce y algo de ácido.,"El fruto tiene una textura como gelatinosa y fibrosa, es una sensación extraña pero agradable",Entre dulce y ácido.,Me recuerda a mi niñez,Comidad,"Que los frutos tengan un buen tamaño y se vean sanos, ningún olor que pueda indicar pudricion"
113,2023/10/05 2:31:00 p. m. GMT-5,Mamoncillo,Femenino,Importante,Importante,Nada importante,Importante,Poco importante,Moderadamente importante,Importante,Poco importante,"Se ve muy normal, la textura, el color y la firmeza",Es más claro de lo normal ,"Tiene poco color, usualmente son más verdes y nada de brillo",Ningún olor ,"No provoca ninguna sensación, la textura es un poco áspera y rugosa ","Un poco ácido y dulce a la vez, es muy normal ",Ninguna ,Ninguna ,"La firmeza del fruto sobre todo, y la tonalidad de la cáscara "
114,2023/10/05 2:35:22 p. m. GMT-5,Mamoncillo,Masculino,Poco importante,Poco importante,Moderadamente importante,Importante,Poco importante,Poco importante,Moderadamente importante,Poco importante,"Buena apariencia, buen sabor y agradable ","Buena apariencia, jugosa y buen sabor ","Color, brillante y llamativo ",Ninguno en particular ,Astringente al final del consumo ,"Dulce, agradable ",Infancia ,Agradable y dulce ,Cantidad de producto obtenido 
115,2023/10/05 2:35:30 p. m. GMT-5,Mamoncillo,Femenino,Moderadamente importante,Muy importante,Moderadamente importante,Muy importante,Poco importante,Poco importante,Importante,Poco importante,Algunos daños posiblemente  por plagas y color verde,Buena apariencia interna,Intensidad intermedia provoca sensación de que está sucio,No tiene un olor muy fuerte,Tiene una textura un poco aspera me provoca sensación agradable,Sabor dulce y me agrada,Niñez cuando iba de vacaciones a tierra caliente,Agradable,La firmeza y tamaño
116,2023/10/05 2:39:11 p. m. GMT-5,Mamoncillo,Femenino,Muy importante,Muy importante,Importante,Importante,Importante,Importante,Importante,Poco importante,Verdes algunos manchados con negro algunos aguados,"Suave, jugoso, baboso",Se ve masticable,Como ,Babosa,Esta rico,A mi infancia,Gusto,"Que s
Este bonito y grande"
117,2023/10/05 2:39:17 p. m. GMT-5,Mamoncillo,Femenino,Importante,Importante,Poco importante,Importante,Poco importante,Importante,Importante,Poco importante,"Firme, con manchas en la cáscara ","Esta bien, de color amarillo ",El dolor de la cáscara no está tan verde ,El aroma es agradable y normal ,Es suave,El sabor es muy agradable,Cuando era niñas comía esta fruta y es una de mis favoritas,Gusto y querer probar más ,Que esté bien redonda y de color verde claro 
118,2023/10/05 2:40:07 p. m. GMT-5,Mamoncillo,Masculino,Poco importante,Poco importante,Poco importante,Muy importante,Muy importante,Moderadamente importante,Muy importante,Poco importante,Manchas definidas de color oscuro,Suave y esponjoso ,"No aplica brillo, color opaco ",Fuerte,Agradable,Un sabor agradable,,Buena y agradable ,Frutos grandes y blanditos
119,2023/10/05 2:40:16 p. m. GMT-5,Mamoncillo,Femenino,Moderadamente importante,Importante,Poco importante,Importante,Moderadamente importante,Importante,Importante,Moderadamente importante,Buena ,Brillosa con pelos bonita ,"
No muy intenso y sin brillo ",Huele a naturaleza ,Suave la pepa es masticable ,Fresco dulce y un poco acido,Mi abuela ,Bastante buena ,Precio y madurez
120,2023/10/05 2:42:24 p. m. GMT-5,Mamoncillo,Masculino,Muy importante,Importante,Importante,Importante,Importante,Importante,Importante,Importante,Se ve como con manchas de sol en la cáscara ,Se ven bastante apetitoso y fresco,Es poco brilloso por lo cual parece que no va a estar muy jugoso por dentro,Montarme un olor marcado,Es bastante suave y sedoso,Es dulce pero a la vez con un poco de acidez. Me gusta,Me recuerda visitas a fincas ,Me provoca gusto y me da ganas de comer más ,Que la cáscara se vea lo más verde y menos afectada por manchas
121,2023/10/05 5:45:52 p. m. GMT-5,Mamoncillo,Femenino,Poco importante,Importante,Importante,Importante,Poco importante,Importante,Muy importante,Moderadamente importante,Verde ,Amarillo y liso ,Opaca,A una hoja,Medio suave medio seco ,Dulce y amargo ,Ninguna ,Medio viscoso ,Nunca he comprado 
122,2023/10/05 1:38:58 p. m. GMT-5,Zapote,Masculino,Poco importante,Poco importante,Poco importante,Moderadamente importante,Poco importante,Poco importante,Moderadamente importante,Poco importante,Muy maduro ,Muy blando,"Un verdoso no tan brillante, me dan ganas de aplastarlo ",No me huele a nada,"Biscozo, placer ",Dulce ,A mi familia comiendo ,Nada,Ninguno 
123,2023/10/05 1:45:05 p. m. GMT-5,Zapote,Masculino,Muy importante,Muy importante,Muy importante,Muy importante,Muy importante,Muy importante,Muy importante,Moderadamente importante,"Tamaño pequeño, textura corrugosa","Fruto pequeño, jugoso ","Color fuerte, opaco","Olor intenso, produce frescura ",Textura corrugusa,"Sabor agradable, fuerte y produce frescura",Cuando compartíamos en el colegio a la hora de los descansos ,Agradable ,"Color, precio"
124,2023/10/05 1:48:54 p. m. GMT-5,Zapote,Masculino,¿Qué tan importante es para ti el color del fruto al momento de comprarlos en el mercado?,¿Qué tan importante es para ti la apariencia del fruto al momento de comprarlos en el mercado?,¿Qué tan importante es para ti el aroma del fruto al momento de comprarlos en el mercado?,¿Qué tan importante es para ti la textura y firmeza del fruto al momento de comprarlos en el mercado?,¿Qué tan importante es para ti el tamaño del fruto al momento de comprarlos en el mercado?,¿Qué tan importante es para ti el estado de madurez del fruto al momento de comprarlos en el mercado?,¿Qué tan importante es para ti el precio en relación a la calidad del fruto al momento de comprarlos en el mercado?,¿Qué tan importante es para ti el origen del fruto al momento de comprarlos en el mercado?,Describe el estado general del fruto (Apariencia externa),Describe el estado general del fruto (Apariencia interna),Describe la intensidad de color y brillo de la cáscara (si aplica el brillo) y lo que te provoca al verlo,Describe el aroma del producto y lo que te produce el producto al momento de olerlo,Descripción de la textura del producto y la sensación que te provoca,Describe el sabor y lo que te provoca el sabor,¿Qué remembranza te provoca la fruta? (remembranza: recuerdos),¿Que sensación te provoca la fruta? (A nivel general),Describe que criterios tienes al momento de adquirir este producto en un lugar de mercado
125,2023/10/05 1:49:22 p. m. GMT-5,Zapote,Femenino,Moderadamente importante,Moderadamente importante,Moderadamente importante,Moderadamente importante,Moderadamente importante,Moderadamente importante,Moderadamente importante,Moderadamente importante,"Se ve fresco, brillante, atractivo",,"Muy brillante, atractiva para comer",Inoloro,"Se ve firme, da gusto verlo",Esta rico,"Poco, casi no la había probado antes","Gusto, expectativa",Color y frescura
126,2023/10/05 1:49:40 p. m. GMT-5,Zapote,Femenino,Moderadamente importante,Muy importante,Moderadamente importante,Moderadamente importante,Muy importante,Muy importante,Muy importante,Moderadamente importante,Grande y duro con cáscara gruesa ,Carnoso peludo con pepa grande,Naranja fuerte muy brillante me provoca comer ,Aroma a tierra ,Cernoso con pelos provoca morder ,Sabor dulce y dan ganas de hacer un jugo ,Neiva ,Me provoca hacer un jugo ,Tamaño precio y madures 
127,2023/10/05 1:49:42 p. m. GMT-5,Zapote,Masculino,Importante,Importante,Importante,Moderadamente importante,Importante,Importante,Muy importante,Moderadamente importante,Se ve bien ,Jugoso,Color apagado,Huele bien ,Suave,Sabe bien,Ninguno,Está rico,No lo compro 
128,2023/10/05 1:51:53 p. m. GMT-5,Zapote,Femenino,Importante,Importante,Importante,Importante,Importante,Importante,Importante,Importante, Firme buen color , Naranja intensoñ, Naranja brillo alto , Aromatico,Algodonosa ,Agridulce ,Animo,Placer, Color olor 
129,2023/10/05 1:52:23 p. m. GMT-5,Zapote,Masculino,Muy importante,Muy importante,Importante,Muy importante,Moderadamente importante,Muy importante,Importante,Moderadamente importante,Buena firmeza,Buen color y textura,Uniforme ,Normal,Perfecta,Delicioso,Mi mamá me daba cuando la visitaba en el trabajo,Frecura,Que este en buen estado
130,2023/10/05 1:53:55 p. m. GMT-5,Zapote,Femenino,Muy importante,Importante,Muy importante,Importante,Moderadamente importante,Muy importante,Importante,Moderadamente importante,"En General deshidratado, tamaño medio. ","Color intenso, llamativo, jugoso ","Intenso, llamativo, Gasca de consumo ","Intenso, azucarado, ganas de consumo ","Suave, jugosa. ",Delicioso. ,"A tierra cálida, momentos específicos del año",Ganas de consumirla ,Que se pueda encontrar 
131,2023/10/05 1:57:29 p. m. GMT-5,Zapote,Masculino,Importante,Importante,Moderadamente importante,Importante,Moderadamente importante,Importante,Importante,Moderadamente importante,No es llamativo ,Si es llamativo ,No es brillante ,No huele ,Es rico ,Es rico,Ninguna ,Me gusta,Nivel de madurez 
132,2023/10/05 1:57:32 p. m. GMT-5,Zapote,Femenino,Importante,Importante,Importante,Importante,Importante,Importante,Importante,Importante,Es curioso ,Se ve en un muy buen estado ,"Es opaca, pero es llamativa",No tiene un olor característico ,Es peludita ,"Es dulce, un poco incipida ",Mango ,,
133,2023/10/05 1:57:51 p. m. GMT-5,Zapote,Masculino,Importante,Muy importante,Moderadamente importante,Muy importante,Muy importante,Importante,Muy importante,Poco importante,Enfermo con muchos puntos de afectaciones,Sano con color naranja parejo ,Opaco ,Huele dulce y me dan ganas de comerlo ,"Muy fibroso, se enreda en los dientes ",Dulce y me da sed ,Cuando se compraban varias frutas a veces se llevaba y era rico ,Poca pulpa y muy fibroso pero dulce ,Que la cáscara sea firme y continua con buen color 
134,2023/10/05 2:01:09 p. m. GMT-5,Zapote,Masculino,Moderadamente importante,Importante,Poco importante,Moderadamente importante,Importante,Muy importante,Muy importante,Nada importante,"color verde oliva muy oscuro, se ve compacto y fresco, no se ven imperfecciones, muy bonito","naranja muy intenso, medianamente húmedo, blando al tacto","externamente es muy opaco, nada brillante pero se ve provocativo ","huele muy fresco, muy frutal","bastante fibroso y acuoso, es un poco incomodo de comer","sabor muy frutal, muy dulce, similar a la papaya, algo refrescar ",a mis familiares ,indiferencia ,el tamaño y el estado de madurez 
135,2023/10/05 2:01:29 p. m. GMT-5,Zapote,Masculino,Poco importante,Importante,Poco importante,,Importante,Muy importante,Importante,Importante,Aptecible,Provicativa,Naranja brillante,Dulce y agradable,Fibrosa,Dulce y tranquilidad ,Bajando zapotes de un árbol en caldas,Felicidad,El tamaño
136,2023/10/05 2:02:01 p. m. GMT-5,Zapote,Femenino,Moderadamente importante,Moderadamente importante,Moderadamente importante,Moderadamente importante,Poco importante,Moderadamente importante,Muy importante,Muy importante,El fruton en si se ve feo,Parece mango pero mas potente,Negro y muy poco llamativo,Aroma agradable ,Provoca un exceso de dulce y ganas de tomar agua ,Muy dulce y empalagoso,Mi abuela me lo hacia comer cuando no habia plata ,Bienestar y llenura,Higiene y precio 
137,2023/10/05 2:02:52 p. m. GMT-5,Zapote,Femenino,Importante,Poco importante,Poco importante,Moderadamente importante,Importante,Muy importante,Importante,Poco importante,No sabría decirlo por que es café ,Provocativo ,No tiene brillo ,Un olor a mango ,A tal cual mango mezclado con chontaduro ,A comer mango arenoso ,A comer mango ,Agradable es rico ,Que no hayan partes muy blanditas 
138,2023/10/05 2:03:40 p. m. GMT-5,Zapote,Femenino,Moderadamente importante,Importante,Nada importante,Moderadamente importante,Moderadamente importante,Importante,Muy importante,Moderadamente importante,Es muy opaco,Parece un mango,Es muy opaco,No tengo sentido del olfato,,No me gusto,Ninguna,,
139,2023/10/05 2:06:23 p. m. GMT-5,Zapote,Masculino,Importante,Muy importante,Moderadamente importante,Importante,Importante,Importante,Importante,Poco importante,"Maduro, no se ve tan sano, alguno tiene un poco de hongo","Color agradable,  en el punto",,,Como el mango,Mango,Infancia,A querer más,"Precio, calidad"
140,2023/10/05 2:06:55 p. m. GMT-5,Zapote,Masculino,Muy importante,Muy importante,Muy importante,Muy importante,Muy importante,Muy importante,Muy importante,Muy importante,Esta en buen estado,Esta sano creo,Es muy llamativo por su color ,"Huele feo, como inmaduro",La textura es fibrosa y fea ,El sabor es dulce y rico ,Nunca lo habia provado,"Me da ansiedad, siento que es un dulce",Que sea llamativo de color
141,2023/10/05 2:08:25 p. m. GMT-5,Zapote,Femenino,Muy importante,Muy importante,Poco importante,Muy importante,Muy importante,Muy importante,Muy importante,Nada importante,"Tiene como manchas y pecas que me hacen pensar que están enfermas, eso le quita calidad, además no están firmes, tal vez porque ya han Sido muy manipulados",Delicioso en todo el sentido ,"La cáscara es suave, no brilla ","Huele delicioso, me provoca comer mucho",Nada ,Me da hambre ,Nada general,Tranquilidad,Que sea grande y este bonito
142,2023/10/05 2:08:55 p. m. GMT-5,Zapote,Masculino,Importante,Importante,Importante,Importante,Poco importante,Importante,Importante,Poco importante,Que sea de colores frescos ,Textura dura,Colores frescos ,Disfrutarlo,De saborearlo,Disfrutarlo por bue  tiempo ,El campo,Comprarlo,Que este fresco 
143,2023/10/05 2:10:01 p. m. GMT-5,Zapote,Femenino,Importante,Importante,Importante,Importante,Importante,Importante,Importante,Moderadamente importante,"Color café, apariencia curiosa para ser naranja por dentro ","Color naranja, peludita algunas pepas grandes ",Color café ,Me gusta ,Me gusta ,Me gusta ,Fue mi fruta favorita en algún tiempo ,Me gusta ,Que sea un lugar medianamente limpio y que la fruta se encuentre en buen estado 
144,2023/10/05 2:10:15 p. m. GMT-5,Zapote,Femenino,Moderadamente importante,Moderadamente importante,Importante,Moderadamente importante,Moderadamente importante,Muy importante,Moderadamente importante,Importante,Muy diferente a lo que conozco,Diferente,Buena,Bueno,Bueno,Bueno,Burno,,
145,2023/10/05 2:12:55 p. m. GMT-5,Zapote,Masculino,Moderadamente importante,Muy importante,Muy importante,Moderadamente importante,Nada importante,Nada importante,Nada importante,Nada importante,"Buena apariencia, maduro",Parece papaya,"Es un colo parecido a la papa, más bien mate",Huele a tierra,"Es parecida al mango, como fibrosa","Es un sabor nuevo, interesante, dulce, parecido al mango",Es la primera vez que lo pruebo en la vida,Dulzura,"Quizás el color, la verdad no manejaria criterios ya que no lo conozco mucho"
146,2023/10/05 2:19:47 p. m. GMT-5,Zapote,Masculino,Nada importante,Nada importante,Nada importante,Importante,Importante,Nada importante,Importante,Nada importante,Fresco y firme,Fibrosa y jugosa,La cáscara tenía baja intensidad de color y  brillo. Externamente no provoca nada ,No le sentí olor característico,Suave ,"Es dulce, me parece mango",Me recuerda el mango,"Me gusta, es jugosa y lechosa ",La firmeza
147,2023/10/05 2:20:22 p. m. GMT-5,Zapote,Masculino,Poco importante,Importante,Poco importante,Poco importante,Moderadamente importante,Muy importante,Importante,Poco importante,Bueno,Bueno,Opaci,A verdura,"Fibroso, suave","Dulce, a melocoterp",Niñez,No me gustan las fibras en los dientes,Estado fitosanitario 
148,2023/10/05 2:21:15 p. m. GMT-5,Zapote,Femenino,Moderadamente importante,Moderadamente importante,Poco importante,Importante,Moderadamente importante,Importante,Importante,Poco importante,"Es liso pero no brilloso, sino más opaco, tiene un color verde o café, es dura pero se puede deformar","Es baboso, como con fibras, color naranja fuerte, aguado","Pues el color es opaco, pues no se ve tan atractivo por su color café verdoso",Es como un olor a naturaleza o tierra ,"se siente duro al medio,se parece al mango pero en textura más no en sabor, es aguado. Es fibroso","Es refrescante, dulce, aguado ","Me acuerda al mango en textura y un poco en lo dulce, me acuerda en algo a la calabaza o a la ahuyama","Pues es rica, dulce, tiene buen contenido para comer, es aguado por lo que uno se mancha","Pues el color naranja adentro, la textura dura en la fruta y el color uniforme"
149,2023/10/05 2:21:38 p. m. GMT-5,Zapote,Masculino,Poco importante,Poco importante,Poco importante,Poco importante,Poco importante,Poco importante,Poco importante,Poco importante,Apariencia opaca ,Color naranja intenso con muchas fibras,"El fruto externamente no tiene brillo, no me provoca probarlo",Aroma fuerte,Es blando al tocarlo,"Es amargo al inicio y dulce al final, un dulce ostigante",.,No me provoca probarlo,.
150,2023/10/05 2:24:34 p. m. GMT-5,Zapote,Masculino,Moderadamente importante,Importante,Importante,Importante,Importante,Importante,Importante,Poco importante,Buena,Buena,Sin casacara,Buen aroma intenso,Firme,Placer,Tropico,Ricura,Calidad externa
151,2023/10/05 2:31:00 p. m. GMT-5,Zapote,Femenino,Importante,Importante,Importante,Importante,Moderadamente importante,Moderadamente importante,Moderadamente importante,Nada importante,"Tiene un color café con manchas verdes. Se ve en buen estado, consistente","Tiene un normal para el fruto, consistente y en buen estado","No tiene nada de brillo, el color es adecuado para la fruta",Tiene un olor a dulce suave y agradable,"Parecido al mango, con sus pelitos caracteristicos. Suaves",Un sabor de dulce chevere. ,Me recuerda a mi niñez,Felicidad y comodidad,"Que los frutos no estén magullado, que estén firmes."
152,2023/10/05 2:35:22 p. m. GMT-5,Zapote,Masculino,Poco importante,Poco importante,Nada importante,Importante,Importante,Poco importante,Moderadamente importante,Poco importante,Se ve muy normal que pesar de que tiene unos pequeños lunares con textura ,Tiene colores muy vivos y muy normales ,"El color es muy intenso, no tiene brillo ",Ninguno,La textura es blanda y humeda,Parece el sabor de una auyama aunque más dulce,Ninguna,Se ve muy normal ,La firmeza y coloración del fruto
153,2023/10/05 2:35:30 p. m. GMT-5,Zapote,Femenino,Poco importante,Poco importante,Moderadamente importante,Importante,Poco importante,Moderadamente importante,Poco importante,Poco importante,Poco llamativo ,Fresco ,No provoca consumirlo,Nada en particular ,Buena textura y dulce ,Delicioso ,Fruta exótica del caribe ,"Llamativo internamente, insípida externamente ",Ninguno 
154,2023/10/05 2:39:11 p. m. GMT-5,Zapote,Femenino,Moderadamente importante,Importante,Moderadamente importante,Importante,Importante,Poco importante,Importante,Poco importante,Duro y color uniforme ,Color naranja intenso,Color intenso sin brillo,Olor parecido a zanahoria ,Textura lisa,Sabor dulce me agrada ,La finca en Villavicencio ,Me agrada,El tamaño color y firmeza
155,2023/10/05 2:39:17 p. m. GMT-5,Zapote,Femenino,Poco importante,Importante,Poco importante,Importante,Importante,Moderadamente importante,Moderadamente importante,Poco importante,Marrón ,Color naranja intenso,Intenso,No le encuentro aroma,Como hilachas,Es rico jugoso,A mi infancia ,Rico,Que sea grande y que esté blandito
156,2023/10/05 2:40:16 p. m. GMT-5,Zapote,Femenino,Muy importante,Muy importante,Importante,Muy importante,Muy importante,Importante,Muy importante,Poco importante,La cascara tenía pequeñas pecas oscuras,Buena firmeza y tamaño pese a a la condición de la cascara,Color intenso,Olor intenso y agradable,La textura es cremosa y agradable ,Un sabor entre mango y melón ,,Agradable ,Tamaño y firmeza del fruto
157,2023/10/05 2:42:24 p. m. GMT-5,Zapote,Masculino,Moderadamente importante,Moderadamente importante,Importante,Moderadamente importante,Importante,Muy importante,Importante,Importante,Opaca y poco atrayente ,Muy brillante el color,Opaco son brillo ,Increíble muy fresco ,Agradable similar al mango ,A una zanahoria muy dulce y fresca,Pedacitos de zanahoria que me daba mi papa,Exelente ,Tamaño y precio 
158,2023/10/05 5:45:52 p. m. GMT-5,Zapote,Femenino,Importante,Importante,Importante,Importante,Importante,Importante,Importante,Importante,"Se ve bastante sano, solo tiene pequeños puntos negros",Se ve seco y fibroso,Este en general no es un fruto de mucho brillo por ende no califique esto,Nada,"Es un poco fibroso pero suave, me provoca como sequedad en boca","Es dulce, similar a una zanahoria pero con más dulzor ",Ninguna,Es bastante rica y antoja comprarla ,Que sea grande y poco afectado en la cáscara 
0,2023/10/06 6:02:44 p. m. GMT-5,Chirimoya,Masculino,Importante,Importante,Importante,Importante,Moderadamente importante,Importante,Importante,Importante,Bien,Bien,Estaba bien el color,Rico,,Estaba bueno,Guanabana dulce,Una sensación agradable,La maduracion 
1,2023/10/06 6:04:43 p. m. GMT-5,Chirimoya,Femenino,Importante,Importante,Importante,Importante,Importante,Importante,Importante,Importante,Algo oscura su cáscara pero de sabor y apariencia interna muy buena ,Buena,Algo oscura,Bueno,Suave pero no provoca comer al verla por fuera ,Rico,Nunguno,Salud y bienestar,"Color de la cascar, y textura externa"
2,2023/10/06 6:05:47 p. m. GMT-5,Chirimoya,Masculino,Importante,Muy importante,Moderadamente importante,Importante,Poco importante,Importante,Importante,Moderadamente importante,Muy maduro,Bueno ,Regular ,Buena,Regular,Disfrutarlo,El campo ,Disfrutarlo ,Que este en bue  estado 
3,2023/10/06 6:06:15 p. m. GMT-5,Chirimoya,Masculino,Muy importante,Muy importante,Muy importante,Muy importante,Muy importante,Importante,Importante,Moderadamente importante,"Verde oscuro, negrita","Sana, blanca, jugosa","Muy opaco en el exterior, no me dan ganas de tomar la fruta ","Aroma dulce, jugoso","Textura jugosa pero arinosa, rico","Dulce, jugoso, estimulo",Ninguno,"Bienestar, jugosos, agua, dulce, sano","No suelo adquirirlo, no sé encuentra en el mercado con frecuencia "
4,2023/10/06 6:07:28 p. m. GMT-5,Chirimoya,Femenino,Muy importante,Muy importante,Moderadamente importante,Muy importante,Importante,Muy importante,Moderadamente importante,Poco importante,"Se ve bien, firmes, brillantes, textura lisa","Se ve bien blanca, textura agradable","Si se ve brillante, color verde, con café las más maduras", No le detecto aroma,"Textura lisa, ligeramente corrugada","Similar a la guanabana, dulce",Me recuerda estar en mi casa bajando chirimoyas o revisando si ya están para bajar,Sensación de querer comer más fruta,"La calidad de la fruta, que no esté magullado o muy verde, tamaño "
5,2023/10/06 6:07:42 p. m. GMT-5,Chirimoya,Femenino,Importante,Moderadamente importante,Moderadamente importante,Moderadamente importante,Moderadamente importante,Moderadamente importante,Muy importante,Importante,Agradable ,Bueno ,Poco,Agradable,Fibroso,Dulce ,,Felicidad ,Que se vea apetecible 
6,2023/10/06 6:08:10 p. m. GMT-5,Chirimoya,Masculino,Moderadamente importante,Muy importante,Moderadamente importante,Muy importante,Importante,Importante,Muy importante,Poco importante,"fruto de bien tamaño, firme de color bastante oscuro, verdoso","color blanco opaco, con semillas grandes, bastante fibrosa","es bastante oscura, verde muy opaco no brillante ",bastante frutal y dulce ,"fibroso, aguado, provocativo ",bastante frutal y dulce ,me recuerda a otro tipos de frutas como al mango y la guanábana ,"refrescante, dulzor",tamaño y estado de madurez 
7,2023/10/06 6:08:11 p. m. GMT-5,Chirimoya,Masculino,Importante,Moderadamente importante,Importante,Muy importante,Poco importante,Moderadamente importante,Moderadamente importante,Moderadamente importante,,"Cáscara firme, sin daños.","Color verde oscuro opaco, sin brillo ",Ligero dulce,Suave y parece cremosa ,Ligero dulce.,Ninguna en particular ,Algo apetecible ,"Principalmente el aroma que sea intenso, un olor menos opaco "
8,2023/10/06 6:08:59 p. m. GMT-5,Chirimoya,Masculino,Moderadamente importante,Moderadamente importante,Muy importante,Moderadamente importante,Nada importante,Nada importante,Nada importante,Nada importante,"Amagullada, parece un ñame o una guanabana",Jugosa,Es más  bien mate,Dulce,"Jugosa, suave",Es una sensación de dulzura,Es la primera vez que la pruebo,Frescura,Que esté madura
