9,2023/10/06 6:09:18 p. m. GMT-5,Chirimoya,Masculino,Importante,Muy importante,Muy importante,Importante,Moderadamente importante,Importante,Importante,Moderadamente importante,"Un estado muy maduro, de un color oscuro","De buen color, blanco. ","No se ve brillo en la fruta, color externo oscuro a negro ","Olor agradable, frutal.","Textura agradable, sabor como a mango ","Buen sabor, de un sabor dulce ",Mango y guanabana ,"Con un sabor agradable, muy rico ","Olor, madurez"
10,2023/10/06 6:09:47 p. m. GMT-5,Chirimoya,Femenino,Muy importante,Muy importante,Muy importante,Muy importante,Moderadamente importante,Moderadamente importante,Importante,Moderadamente importante,Bonito,Sano,Se ve en buen estado,Es un aroma dulce ,Es una textura arenosa agrdable ,Es un sabor dulce ,Me recuerda a la guanabana ,Agrabable ,Que estrés fresco
11,2023/10/06 6:11:00 p. m. GMT-5,Chirimoya,Femenino,Muy importante,Muy importante,Muy importante,Muy importante,Poco importante,Importante,Muy importante,Poco importante,Apariencia marrón que puede indicar estado de sobremadurez,Buen color del fruto. No se evidencia deterioro,Poco brillante ,Ligero olor,Textura rugosa,Sabor dulce ,Guanábana ,Agradable,No lo compro
12,2023/10/06 6:11:30 p. m. GMT-5,Chirimoya,Masculino,Moderadamente importante,Importante,Moderadamente importante,Muy importante,Importante,Importante,Muy importante,Poco importante,"Se ve uniforme un poco lisa y de color bien, se ve sano y maduro",Es jugoso muy provocativo ,No tiene brillo el color es opaco pero generalmente representa q está madura,No tiene mucho olor aunque si se detalla si es fresco y agradable cuando se abre si genera mucho olor ,Es una textura sedosa ,Es muy rico dulce y refrescante me provoca seguir comiendo es muy deliciosoo,A mi infancia cuando las bajaba de los árboles que encontraba,Muy agradable genera satisfacción y se quisiera continuar comiendo ,Precio y apariencia 
13,2023/10/06 6:11:50 p. m. GMT-5,Chirimoya,Masculino,Moderadamente importante,Muy importante,Importante,Muy importante,Importante,Muy importante,Importante,Importante,"Bien, suave, llamativo. ","Muy bien, sano ","Suave, opaco","Dulce, provoca un deseo de consumir. ","Suave, fresco. Me genera sensación de tranquilidad ","Suave muy rico, delicioso, jugoso. Me genera sensación de consumir más y más. ",Me recuerda al campo… a mi Tierra ,Amor por la tierra ,Que pueda conseguirlo en el mercado. 
14,2023/10/06 6:11:59 p. m. GMT-5,Chirimoya,Masculino,Poco importante,Muy importante,Muy importante,Muy importante,Importante,Muy importante,Muy importante,Poco importante,Fruto con epidermis lisa color verde oscuro con manchas marrones ,Fruta de textura blanda de color blanco,El color y el brillo realmente no provoca alguna sensación o deseo de comerlo,Olor suave similar al de la guanabana ,"Textura blanda y húmeda, con buen estado de maduración ",Sabor similar al de la guanabana,Ninguna ,Recuerdo de la guanabana ,No lo consumo 
15,2023/10/06 6:12:42 p. m. GMT-5,Chirimoya,Masculino,Moderadamente importante,Muy importante,Moderadamente importante,Importante,Importante,Importante,Muy importante,Poco importante,Extraño,Normal,Opaco con puntos oscuros,Dulce y interés,Suave y se siente como delicado en el paladar,Es extraño me recuerda a la guanábana, Nada,"Neutra, no destaca nada",Referencias del vendedor y preparaciones
16,2023/10/06 6:12:46 p. m. GMT-5,Chirimoya,Masculino,Importante,Muy importante,Muy importante,Muy importante,Moderadamente importante,Muy importante,Muy importante,Moderadamente importante,Es verdoso,Blanco ,Es opaco,Huele a guanabana,Suave,Sabe a yogur,Yogur,Gusto,
17,2023/10/06 6:14:28 p. m. GMT-5,Chirimoya,Masculino,Nada importante,Importante,Importante,Moderadamente importante,Moderadamente importante,Moderadamente importante,Muy importante,Poco importante,"Liso, opaco, color verde claro o pálido, sin daños aparentes","Buen color, blanco","Algo de brillo a contra luz, siento que puede ser un indicador de buena calidad ","Aroma dulce, me produce una sensación de gusto","Textura suave, provoca sensación de gusto, calidad ","El sabor es delicioso, dulce, apetecible. Sensación placentera ","A los frutos de guanábana, pero estos don más dulces y de textura más suave ","Una sensación de gusto, de placer general por alimentarme ","Los criterios son la necesidad de alimentación, la apariencia física externa, y el olor"
18,2023/10/06 6:18:07 p. m. GMT-5,Chirimoya,Femenino,Nada importante,Importante,Muy importante,Moderadamente importante,Moderadamente importante,Muy importante,Muy importante,Muy importante,Color oscuro ,Buena apariencia ,Opaco y provoca pensar que está picho,"Olor a pasado, en buen estado huele delicioso ",Textura blanda y sensación suave ,Sabor a anon ,A mi abuelita trayendo anon y chieimoya ,Saciedad,Que no esté muy blando ni muy opaco
19,2023/10/06 6:19:21 p. m. GMT-5,Chirimoya,Femenino,Importante,Importante,Importante,Importante,Moderadamente importante,Importante,Importante,Moderadamente importante,Es un fruto agradable a la vista,Es un fruto con textura suave,"No es una fruta tan vistosa, al contrario es un poco opaca",Es un aroma dulce ,Textura suave y agradable ,Es un sabor agradable,Recuerdos de la casa,Agradable,Que se vea agradable 
20,2023/10/06 6:23:07 p. m. GMT-5,Chirimoya,Femenino,Importante,Muy importante,Muy importante,Importante,Moderadamente importante,Moderadamente importante,Moderadamente importante,Moderadamente importante,"Poco agradable, tonos cafés, no uniforme, no es lisa, tiene hendiduras.","No tiene color uniforme, poco agradable.","Poco brillo, poco agradable.","Poco dulce y un poco descompuesto, un poco descompuesto.",Poco agradable.,"Poco agradable, sabe como si estuviera un poco descompuesto, bajo contenido de azúcar.",Cuando mi mamá hacía jugo de guanábana.,Poco agradable.,"Estado de madurez, precio, aspecto, firmeza, olor, sabor."
21,2023/10/06 6:23:47 p. m. GMT-5,Chirimoya,Masculino,Importante,Importante,Importante,Importante,Importante,Importante,Importante,Poco importante,Bonito,"Suave, Blanco","Color opaco, verde oscuro ",Suave a fruto fresco ,Textura fibrosa y cremosa,Sabor a Anon ,Al campo en la finca de mis abuelos a una planta de Anon,Algo rico porque es dulce y agrio,"La firmeza, olor, color y precio "
22,2023/10/06 6:24:40 p. m. GMT-5,Chirimoya,Masculino,Moderadamente importante,Importante,Moderadamente importante,Importante,Poco importante,Importante,Importante,Poco importante,Buen estado,Presencia regular,"Ausencia de brillo, inmadurez",Fermentación ,Blando,Fruto dulce pero sensación añeja ,A frutos sobremaduros,Mal estado,"Textura, olor y apariencia"
23,2023/10/06 6:25:43 p. m. GMT-5,Chirimoya,Masculino,Muy importante,Importante,Poco importamte,Importante,Importante,Importante,Importante,Nada importante,Blandita como verde ,Bien apetitosa ,Un brillo oscuro limpio,Me recuerda el olor a yogurt muy rico ,Es como babosa arenosa ,Sabor a yogurt de guanábana ,Las chicas dando muestras de fruta ,Muy rica ,Que no se sienta ni muy dura ni muy blandita 
24,2023/10/06 6:28:19 p. m. GMT-5,Chirimoya,Femenino,Poco importante,Muy importante,Moderadamente importante,Muy importante,Moderadamente importante,Moderadamente importante,Importante,Nada importante,"Firme, agradable ","Brillante, suave, jugoso",Intensidad alta y poco brillante,"Aroma a fruto fresco y dulce, Satisfacción ",Textura suave y sensación satisfactoria ,Dulce,Infancia y pueblo,Punto medio ,Que se vea fresca 
25,2023/10/06 6:32:02 p. m. GMT-5,Chirimoya,Masculino,Poco importante,Poco importante,Importante,Poco importante,Importante,Muy importante,Importante,Importante,"Se ve bien, el color tanto blanco como verde siempre es agradable y recuerda la guanábana. ",Se nota muy jugosa y apetitosa.,No es tan brillanté y hay frutas que a la vista se ven más agradables.,No olía demasiado en comparación con otro frutos como los cítricos ,Sensación suave y un poco gomosa al mismo tiempo jugosa.,"Es muy dulce, parecido a la guanábana con la diferencia que no es ácida, provoca querer comer más ","Niñez en el campo comiendo guanábana, es la primera vez que la pruebo pero se asemeja bastante a la guanábana.","Agua la boca, el sabor no es tan abrumador lo que posibilita poder comer más ","El lugar de donde proviene, orgánica o no y la relación peso precio "
26,2023/10/06 6:32:40 p. m. GMT-5,Chirimoya,Masculino,Importante,Importante,Poco importamte,Moderadamente importante,Moderadamente importante,Importante,Importante,Importante,Luce un poco maduro ,Se encuentra bastante blando ,Se encontraba un poco oscuro ,Huele dulce y me produce antojo ,Suave y antojo ,Estaba un poco fermentado ,No recuerdo ,Buena ,"Costo, lugar de origen, persona que se beneficia de la comercialización "
27,2023/10/06 6:33:24 p. m. GMT-5,Chirimoya,Femenino,Muy importante,Muy importante,Muy importante,Muy importante,Moderadamente importante,Importante,Muy importante,Moderadamente importante,Tiene buen color y tamaño,"Buena consistencia, color y olor","Color verde intenso, provoca antojo","Aroma suave, algo neutro. Salivación ","Suave, granulosa","Sabor dulce, genera algo de frescura",Niñez ya que comía mucha guanabana,Es agradable al gusto,Que este compacta y no se sienta muy blandita
28,2023/10/06 6:37:24 p. m. GMT-5,Chirimoya,Femenino,Muy importante,Muy importante,Muy importante,Importante,Importante,Importante,Muy importante,Poco importante,"Firme, brillante","Firme y suave, color crema","Verde con algunas coloraciones rojizas, brillante, se ve de","Dulce con un poco de ácido, me gusta como huele ","Blanda, no me agrada, parece una mantequilla y prefiero las texturas más fibrosas ","Muy dulce, me gusta, pero preferiría que fuera un poco más ácido ",Ninguna ,Gusto ,"Color, aroma, precio, aspecto físico "
29,2023/10/06 6:38:28 p. m. GMT-5,Chirimoya,Masculino,Poco importante,Importante,Importante,Moderadamente importante,Importante,Importante,Muy importante,Moderadamente importante,Bueno,Se ve como guanábana ,"No provoca de golpe, pero el color interno si es apetecible ",Es dulce y rico,Suave y granulosa,Sabe a guanabana pero más rico,Estar en mi tierra natal,Me gusta ,Los mismos criterios que con la guanábana 
30,2023/10/06 7:00:37 p. m. GMT-5,Chirimoya,Femenino,Importante,Importante,Muy importante,Moderadamente importante,Importante,Muy importante,Muy importante,Muy importante,"Verdoso, con poca firmeza por lo que se observa ",Cremoso.,"Es un poco brilloso, pero se ve apetitoso.","Olor dulzón, dan ganas de probarlo.","Es cremosa, ","Dulzón, seguir comiendo.",A la guanábana.,"Buena, estaba muy rica.","Calidad, color, el tamaño y olor "
31,2023/10/09 3:23:03 p. m. GMT-5,Chirimoya,Femenino,Muy importante,Muy importante,Muy importante,Muy importante,Importante,Muy importante,Muy importante,Poco importante,Buena,Bueno,Fruto opaco y manchado,Suave y rico,Suave ,Dulce,Guanábana más dulce,Me gusta,"Color, textura y olor"
32,2023/10/09 3:23:45 p. m. GMT-5,Chirimoya,Masculino,Importante,Importante,Importante,Importante,Moderadamente importante,Moderadamente importante,Muy importante,Poco importante,En buen estado,Medio maduras y marrones,Colores opacos y neutros a la vista ,Muy neutro,Frescura y suavidad,"Muy dulce pero a punto de consumo,agradable al paladar",Primera vez que consumo ,Nuevos sabores y sensaciones endulzantes,"El precio, el estado de la cascara y la higiene "
33,2023/10/09 3:23:50 p. m. GMT-5,Chirimoya,Femenino,Importante,Importante,Nada importante,Moderadamente importante,Muy importante,Muy importante,Importante,Nada importante,"El fruto se ve con coloración característica, firme y con tonos opacos","Jugosa, lechos y suave",Tiene baja intensidad de brillo y no me produce nada al verlo,Es un aroma similar al de la papaya y me recuerda a esta,Me gusta la textura interna y me gustaría seguir probando mas,El sabor es dulce y dan ganas de seguir comiendo,Me recuerda a la guanábana y el olor a papaya ,Me gusta y compraría la fruta ,El tamaño y la firmeza
34,2023/10/09 3:27:54 p. m. GMT-5,Chirimoya,Femenino,Muy importante,Muy importante,Muy importante,Importante,Moderadamente importante,Importante,Importante,Importante,Una apariencia fresca y textura lisa.,Textura suave y agradable,La cáscara es fresca ,Tiene un aroma agradable y fresco,Es suave y refresca,Es apetecible y agradable ,Llanos orientales ,Satisfaccion ,Que no tenga golpes y este fresca 
35,2023/10/09 5:41:36 p. m. GMT-5,Chirimoya,Masculino,Muy importante,Importante,Moderadamente importante,Moderadamente importante,Moderadamente importante,Importante,Muy importante,Nada importante,buenos,"mala, fermentado",no brilla un poco apetito ,bueno,buena,regular,guanabana ,buena,que sea limpio 
36,2023/10/09 5:43:33 p. m. GMT-5,Chirimoya,Masculino,Importante,,Importante,Importante,Moderadamente importante,Importante,Muy importante,Nada importante,Bien ,Bien ,Muy opaco,Aroma fuerte ,Cómo guanabana más dura ,Similar a la guanabana ,Guanabana  o a una guatila ,Igual a una fruta normal ,"Ganas de comerlo, precio "
37,2023/10/09 5:44:47 p. m. GMT-5,Chirimoya,Masculino,Muy importante,Muy importante,Muy importante,Importante,Importante,Importante,Importante,Importante,Sabor a mango maduro variedad azúcar. Muy delicioso. Buena apariencia.,Muy buena.,Muy intensa.,Aroma agradable.,Rugosa.,Dulce. Sabor a mango maduro variedad azúcar.,Recuerdos de la costa caribe.,Deliciosa.,Sanidad.
38,2023/10/09 5:45:15 p. m. GMT-5,Chirimoya,Masculino,Importante,Muy importante,Muy importante,Muy importante,Importante,Muy importante,Muy importante,Importante,Se ve inmadura y dura ,Madura y de buena textura,No me dan ganas de comerlo ,Es muy similar a la guanabana ,De textura suave y sensación agradable ,Sabor a guanabana y me provoca alegría gustativa,A la guanabana ,Una sensación agradable en el paladar,Que sea cercano y que haya una calidad-precio
39,2023/10/09 5:57:19 p. m. GMT-5,Chirimoya,Femenino,Muy importante,Muy importante,Moderadamente importante,Moderadamente importante,Moderadamente importante,Importante,Importante,Muy importante,Flacida,Textura suave,No tiene brillo ,Aroma fermentado ,Extraño ,Dulce satisfacción ,Ninguno porque no había comido antes,Pastocidad,Que este madura 
40,2023/10/09 5:57:33 p. m. GMT-5,Chirimoya,Masculino,Moderadamente importante,Importante,Importante,Moderadamente importante,Moderadamente importante,Importante,,Poco importante,"Color verde intenso, de buena apariencia, estado uniforme ","Color blanco intenso, de textura suave ","Opaca, su forma ",Agradable ,Suave y agradable al paladar ,Dulce ,Casa ,Antojo ,Que esté en el estado apropiado de maduración 
